2010-05-09,Train fault at Lewisham,08:10,Cannon St,Gillingham,terminated at Blackheath
2010-05-09,Train fault at Lewisham,09:54,Gillingham,Cannon St,started at Dartford
2010-05-09,Trespasser on the line,09:06,Orpington,Victoria,delayed by 12 minutes
2010-05-09,Trespasser on the line,09:51,Victoria,Orpington,delayed by 19 minutes and did not call at Brixton
2010-05-09,Train crew delayed,09:55,Ramsgate,Whitstable,delayed by 10 minutes
2010-05-09,Planning error,13:28,Gillingham,St Pancras International,started at Rochester
2010-05-09,Train fault at Kent House,15:36,Orpington,Victoria,terminated at Kent House
2010-05-09,Train fault at Kent House,16:21,Victoria,Orpington,delayed by 14 minutes
2010-05-09,Station issue,22:16,Cannon St,Orpington,delayed by 10 minutes
